{"$id":"https://schemas.uor.foundation/prismpm/sdk-lock/2","$schema":"https://json-schema.org/draft/2020-12/schema","additionalProperties":false,"properties":{"platforms":{"items":{"additionalProperties":false,"properties":{"inventory":{"items":{"additionalProperties":false,"properties":{"digest":{"pattern":"^sha256:[0-9a-f]{64}$","type":"string"},"id":{"maxLength":128,"minLength":1,"type":"string"},"kind":{"enum":["binary","crate","image","adapter","oracle","schema","workflow","base-image","dependency-lock","trust-root","test-corpus"]},"version":{"maxLength":128,"minLength":1,"type":"string"}},"required":["digest","id","kind","version"],"type":"object"},"maxItems":8192,"minItems":1,"type":"array","uniqueItems":true},"inventory_digest":{"pattern":"^sha256:[0-9a-f]{64}$","type":"string"},"manifest_digest":{"pattern":"^sha256:[0-9a-f]{64}$","type":"string"},"platform":{"enum":["linux/amd64","linux/arm64"]},"inventory_document":{"type":"string","minLength":1,"maxLength":8388608}},"required":["inventory","inventory_digest","inventory_document","manifest_digest","platform"],"type":"object"},"maxItems":2,"minItems":2,"type":"array","uniqueItems":true},"schema":{"const":"prismpm/sdk-lock/2"},"sdk_image":{"pattern":"^[a-z0-9.-]+(?::[0-9]{1,5})?/[a-z0-9./_-]+@sha256:[0-9a-f]{64}$","type":"string"},"sdk_index":{"maxLength":1048576,"minLength":1,"type":"string"},"sdk_version":{"const":"0.3.0"},"standards_lock":{"pattern":"^sha256:[0-9a-f]{64}$","type":"string"}},"required":["platforms","schema","sdk_image","sdk_index","sdk_version","standards_lock"],"type":"object"}
